類別	名稱	地址
星巴克	南崁特力門市	桃園市蘆竹區中正路1號
星巴克	南崁門市	桃園市蘆竹區南山路一段2-5號
星巴克	八德介壽門市	桃園市八德區介壽路一段728號1樓
星巴克	桃園台茂門市	桃園市蘆竹區南崁路一段112號
星巴克	桃園國際門市	桃園市桃園區國際路二段468號
星巴克	八德桃大門市	桃園市八德區金和路35號
星巴克	桃園中山門市	桃園市桃園區中山路879號
星巴克	桃愛門市	桃園市桃園區中山路939號 (位於愛買購物中心內)
星巴克	蘆竹大竹門市	桃園市蘆竹區大竹路430-1號
星巴克	礁溪門市	宜蘭縣礁溪鄉礁溪路5段118號
星巴克	中壢休息站門市	桃園市中壢區內定二街998之3號 (中山高速公路中壢休息站)
星巴克	內壢環中東門市	桃園市中壢區環中東路168號
星巴克	內壢門市	桃園市中壢區中華路一段450號1樓
星巴克	大溪門市	桃園市大溪區慈湖路49及51號
星巴克	內壢中華門市	桃園市中壢區中華路一段669號
星巴克	宜蘭頭城門市	宜蘭縣頭城鎮青雲路3段396號
星巴克	一航廈3F門市	桃園市大園區埔心村航站南路15號3樓 (北) (管制區外)
星巴克	中原大學門市	桃園市中壢區中北路200號
星巴克	二航管制4F門市	桃園市大園區航站南路9號4樓 (桃園機場第二航廈管制C區4樓)
星巴克	二航廈5F門市	桃園市大園區航站南路9號5樓
星巴克	新二航廈B2門市	桃園市大園區航站南路9號B2
星巴克	二航廈D3門市	桃園市大園區航站南路9號3F (管制區內，鄰近D區登機門處)
星巴克	二航廈4F門市	桃園市大園區航站南路9號4樓 (桃園機場第二航廈)
星巴克	中壢大江門市	桃園市中壢區中園路二段509號1樓
星巴克	中壢大潤發門市	桃園市中壢區中北路二段468號1樓
星巴克	華泰三期門市	桃園市中壢區春德路159號
星巴克	中壢元化門市	桃園市中壢區元化路305號1F
星巴克	中壢海華門市	桃園市中壢區九和二街13號1樓
星巴克	青埔門市	桃園市中壢區高鐵北路一段6號
星巴克	復興門市	桃園市中壢區中山路138號1樓
星巴克	青埔影城門市	桃園市中壢區春德路107號1樓
星巴克	青埔華泰門市	桃園市中壢區春德路189號 1樓
星巴克	青埔高鐵南門市	桃園市中壢區高鐵南路二段231號 (近桃園捷運 A19站)
星巴克	宜蘭門市	宜蘭縣宜蘭市舊城東路56號
星巴克	宜蘭新月門市	宜蘭縣宜蘭市民權路二段38巷6號1樓
星巴克	大園門市	桃園市大園區中正東路 232號
星巴克	平鎮民族門市	桃園市平鎮區民族路二段209號
星巴克	龍潭中科院門市	桃園市龍潭區中正路佳安段481號 (中科院新新餐廳1F)
星巴克	平鎮家樂福門市	桃園市平鎮區莊敬里48鄰坤慶路1號
星巴克	龍潭門市	桃園市龍潭區北龍路292-1及292-2號
星巴克	楊梅埔心門市	桃園市楊梅區中山北路二段287號
星巴克	楊梅中山門市	桃園市楊梅區中山北路一段338號
星巴克	羅東門市	宜蘭縣羅東鎮興東路97號
星巴克	六家門市	新竹縣竹北市高鐵七路6號1F
星巴克	竹北華邦電門市	新竹縣竹北市文興路二段539號
星巴克	湖口休息站門市	新竹縣北埔鄉榮光路158號(國道一號湖口北向服務區)
星巴克	台元二門市	新竹縣竹北市台元一街2號
星巴克	竹北光明門市	新竹縣竹北市光明六路東一段316號
星巴克	台元門市	新竹縣竹北市台元科技園區台元街34號
星巴克	竹北遠百門市	新竹縣竹北市莊敬北路18號7
星巴克	竹北文興門市	新竹縣竹北市文興路一段186號
星巴克	竹北自強門市	新竹縣竹北市自強南路182號
星巴克	新竹北門市	新竹縣竹北市光明一路372號
星巴克	新竹新豐門市	新竹縣新豐鄉新興路202號
星巴克	新竹日光門市	新竹市東區關新路38號1樓
星巴克	新竹關埔門市	新竹市東區埔頂二路71 號
星巴克	介壽門市	新竹市東區介壽路47號
星巴克	新竹達門市	新竹市東區力行二路1號
星巴克	聯發科門市	新竹市東區篤行一路1號
星巴克	台積電門市	新竹市東區新竹科學園區力行六路8號4樓
星巴克	台積電12P7門市	新竹市東區園區二路188號
星巴克	台積電P4門市	新竹市東區科學園區園區二路168號
星巴克	光復清大門市	新竹市東區光復路二段406號
星巴克	公道五門市	新竹市東區公道五路二段469號 1樓
星巴克	新竹大潤發門市	新竹市東區忠孝路300號1樓
星巴克	新竹台醫門市	新竹市北區經國路一段442巷25號
星巴克	台積電5門市	新竹縣寶山鄉園區三路121號
星巴克	研新門市	新竹市東區科學園區研新二路6號
星巴克	新竹動物園門市	新竹市東區博愛街111號
星巴克	新竹巨城門市	新竹市東區中央路223號 1樓
星巴克	新竹大魯閣門市	新竹市北區湳雅街 91 之2 號
星巴克	園區門市	新竹市北區新竹科學工業園區研新一路9號1樓
星巴克	新竹北大門市	新竹市東區北大路109 號
星巴克	新竹護城河門市	新竹市東區林森路18號
星巴克	西大門市	新竹市東區西大路323號1樓
星巴克	新竹竹光門市	新竹市北區西大路687號
星巴克	頭份尚順門市	苗栗縣頭份鎮中央路105號1F
星巴克	頭份中央門市	苗栗縣頭份鎮中央路372號
星巴克	竹南門市	苗栗縣竹南鎮環市路二段112號
星巴克	花蓮和平門市	花蓮縣秀林鄉和平263號
星巴克	苗栗高鐵門市	苗栗縣後龍鎮高鐵三路268號
星巴克	苗栗國華門市	苗栗縣苗栗市國華路1128號
星巴克	西湖休息站門市	苗栗縣西湖鄉湖東村8鄰埔頂29號
星巴克	花蓮中央門市	花蓮縣花蓮市中央路四段11號
星巴克	花蓮新站門市	花蓮縣花蓮市國聯一路100號
星巴克	泰安北門市	台中市后里區九甲七路400號
星巴克	泰安南門市	台中市后里區安眉路113號
星巴克	美光門市	台中市后里區后科南路88號(2樓餐廳)
星巴克	花蓮遠百門市	花蓮縣花蓮市和平路581號
星巴克	麗寶鐘樓門市	台中市后里區月眉東路2段181號
星巴克	花蓮門市	花蓮縣花蓮市中山路231號
星巴克	清境門市	南投縣仁愛鄉定遠新村26-1號1樓
星巴克	台中麗寶門市	台中市后里區福容路201號
星巴克	豐原向陽門市	台中市豐原區向陽路182號
星巴克	洄瀾門市	花蓮縣吉安鄉南濱路一段505號
星巴克	豐原門市	台中市豐原區復興路2號
星巴克	大甲門市	台中市大甲區順天路202號及202之2號
星巴克	豐原家樂福門市	台中市豐原區成功路500號1F
星巴克	台中慈濟門市	台中市潭子區豐興路一段88號二樓
星巴克	潭子門市	台中市潭子區勝利路188號
星巴克	軍功東山門市	台中市北屯區軍功路一段720號
星巴克	崇德昌平門市	台中市北屯區崇德路三段398號
星巴克	大雅門市	台中市大雅區中清路三段1205號
星巴克	松竹門市	台中市北屯區松竹路二段350號
星巴克	文心昌平門市	台中市北屯區文心路四段817號
星巴克	太平門市	台中市太平區中山路四段21號
星巴克	中清門市	台中市北屯區中清路二段769號
星巴克	清水門市	台中市清水區中華路313號
星巴克	中清太原門市	台中市北區中清路一段510號
星巴克	中醫門市	台中市北區育德路2號
星巴克	台積電15門市	台中市大雅區科雅六路1號
星巴克	中醫二門市	台中市北區學士路2號1樓 (位於中國醫藥大學附設醫院五權院區急重症大樓一樓)
星巴克	中友門市	台中市北區三民路三段161號1樓C棟
星巴克	中友二門市	台中市北區三民路三段161號C棟2樓
星巴克	逢甲大學門市	台中市西屯區文華路100號
星巴克	台中友達門市	台中市西屯區中科路1號
星巴克	文心甘肅門市	台中市西屯區文心路三段135號1樓
星巴克	日曜門市	台中市中區自由路二段94號1F
星巴克	埔里門市	南投縣埔里鎮中山路三段245號
星巴克	台中新時代門市	台中市東區復興路四段186號1-1號
星巴克	黎明福科門市	台中市西屯區黎明路三段289號
星巴克	中正繼光門市	台中市中區台灣大道一段138號1樓
星巴克	台中金典門市	台中市西區健行路1049號B1
星巴克	中港門市	台中市西區台灣大道二段363號
星巴克	廣三SOGO門市	台中市西區台灣大道二段459號2樓
星巴克	河南青海門市	台中市西屯區河南路二段431號
星巴克	園道門市	台中市西區公益路68號1樓
星巴克	台中遠百門市	台中市西屯區台灣大道三段251號11樓
星巴克	超億門市	台中市西區公益路128號
星巴克	三越一店門市	台中市西屯區台灣大道三段301號3樓
星巴克	台中三越11門市	台中市西屯區台灣大道三段301號11樓
星巴克	米平方門市	台中市西屯區國安一路168號
星巴克	美村向上門市	台中市西區美村路一段319號
星巴克	朝富門市	台中市西屯區朝富路83號1樓
星巴克	新國門市	台中市西屯區市政北一路1號
星巴克	福康門市	台中市西屯區福康路1.3號1樓
星巴克	大英門市	台中市南屯區公益路二段131號
星巴克	沙鹿門市	台中市沙鹿區沙田路103號
星巴克	市政門市	台中市西屯區市政路581號
星巴克	童綜合門市	台中市梧棲區台灣大道八段699號
星巴克	五權門市	台中市西區五權西路一段277號1樓
星巴克	國資圖門市	台中市南區五權南路100號
星巴克	中榮門市	台中市西屯區台灣大道四段1650號1樓
星巴克	向心門市	台中市南屯區文心路一段197號
星巴克	大里門市	台中市大里區國光路二段411-1號
星巴克	五權惠中門市	台中市南屯區五權西路二段658號
星巴克	MITSUI台中門市	台中市梧棲區台灣大道十段168號
星巴克	文心秀泰門市	台中市南屯區文心南路289號1F
星巴克	大里中興門市	台中市大里區中興路一段173之25號
星巴克	永春東門市	台中市南屯區永春東路1340號
星巴克	中山醫門市	台中市南區建國北路一段110號
星巴克	文心大慶門市	台中市南區文心南路542號
星巴克	烏日中山門市	台中市烏日區中山路一段688號
星巴克	烏日門市	台中市烏日區站區二路8號2樓
星巴克	日月潭門市	南投縣魚池鄉中山路101號
星巴克	草屯門市	南投縣草屯鎮中正路857之1號
星巴克	彰基門市	彰化縣彰化市旭光路235號
星巴克	彰化曉陽門市	彰化縣彰化市曉陽路358號
星巴克	彰化中山門市	彰化縣彰化市中山路二段76號
星巴克	和美門市	彰化縣和美鎮彰化縣和美鎮道周路445號
星巴克	南投休息站門市	南投縣南投市振興里南鄉路250巷142弄6號
星巴克	南投家樂福門市	南投縣南投市三和三路21號1樓
星巴克	員林門市	彰化縣員林鎮中山路二段458號
星巴克	鹿港門市	彰化縣鹿港鎮中正路512號
星巴克	員林大潤發門市	彰化縣埔心鄉中山路319號
星巴克	西螺門市	雲林縣西螺鎮振興里1號
星巴克	斗六中正門市	雲林縣斗六市大學路二段308號
星巴克	斗六門市	雲林縣斗六市雲林路二段190號
星巴克	雲林高鐵門市	雲林縣虎尾鎮站前東路301號
星巴克	虎尾門市	雲林縣虎尾鎮林森路一段491號
星巴克	嘉義民雄門市	嘉義縣民雄鄉建國路一段235號
星巴克	嘉義忠孝門市	嘉義市東區忠孝路790之5號
星巴克	嘉基門市	嘉義市東區忠孝路539號
星巴克	耐斯門市	嘉義市東區忠孝路600號
星巴克	馬祖門市	連江縣南竿鄉福沃村8鄰143-1號
星巴克	嘉義市府門市	嘉義市東區中山路201號1樓
星巴克	嘉邑門市	嘉義市東區垂楊路2號
星巴克	嘉義中山門市	嘉義市東區中山路471號
星巴克	北港門市	雲林縣北港鎮華南路38號
星巴克	中埔穀倉門市	嘉義縣中埔鄉金蘭村頂山門36號
星巴克	垂楊門市	嘉義市東區垂楊路537號1樓
星巴克	嘉義中興門市	嘉義市西區中興路398號
星巴克	嘉義世賢門市	嘉義市東區世賢路四段432之1號
星巴克	嘉義家樂福門市	嘉義市西區博愛路二段461號
星巴克	嘉義高鐵門市	嘉義縣太保市高鐵西路168號
星巴克	嘉朴門市	嘉義縣朴子市嘉朴路西段7號
星巴克	台南東山門市	台南市東山區枋子林74之6號
星巴克	新營門市	台南市新營區中正路6之5號
星巴克	台南善化門市	台南市善化區大同路2號
星巴克	善化陽光門市	台南市善化區陽光大道200號1樓
星巴克	台積電P3門市	台南市善化區南科北路1之1號(P3廠2F)
星巴克	台積電18門市	台南市安定區北園二路8號1F (台積電18廠)
星巴克	台南佳里門市	台南市佳里區新生東路1號
星巴克	南科門市	台南市新市區南科三路17號1樓
星巴克	台南新市門市	台南市新市區中正路71號
星巴克	台東新生門市	台東縣台東市新生路133號
星巴克	台東中華門市	台東縣台東市中華路二段385號
星巴克	澎湖喜來登門市	澎湖縣馬公市新店路197號1樓
星巴克	永康中正門市	台南市永康區中正南路652號
星巴克	台南北安門市	台南市安南區北安路三段156號
星巴克	南台科大門市	台南市永康區南台街一號
星巴克	台南大灣門市	台南市永康區崑大路231、233號
星巴克	永康門市	台南市永康區中華路157號
星巴克	旗山門市	高雄市旗山區延平一路676號
星巴克	台南海佃門市	台南市安南區海佃路一段381號
星巴克	台南小北門市	台南市北區西門路四段307號
星巴克	台南歸仁門市	台南市歸仁區中山路二段118號1F
星巴克	虎尾寮門市	台南市東區裕農路930號
星巴克	成大醫院B1門市	台南市北區勝利路138號B1
星巴克	成大醫院門市	台南市北區小東路35號
星巴克	南紡1F門市	台南市東區中華東路一段366號1F
星巴克	南紡門市	台南市東區中華東路一段366號2樓
星巴克	長榮門市	台南市東區長榮路三段139號
星巴克	成大會館門市	台南市東區勝利路118號1F
星巴克	南遠門市	台南市東區前鋒路210號
星巴克	台南門市	台南市中西區中山路166號1樓
星巴克	三越中山門市	台南市中西區中山路162號B1
星巴克	湖美門市	台南市中西區中華西路二段865號
星巴克	仁德家樂福門市	台南市仁德區中山路711號
星巴克	台南東門門市	台南市東區東門路三段138號
星巴克	府榮門市	台南市東區長榮路一段181號1樓
星巴克	台南西門門市	台南市中西區西門路二段120號
星巴克	府中門市	台南市中西區民生路二段489號
星巴克	台南健康門市	台南市中西區健康路一段36號
星巴克	永福門市	台南市南區西門路一段658號1樓
星巴克	台南德安門市	台南市東區中華東路三段360號1樓
星巴克	永華運動門市	台南市中西區中華西路二段30-2號1F
星巴克	永華門市	台南市安平區中華西路二段16號
星巴克	永華國平門市	台南市安平區永華路二段721號
星巴克	MITSUI台南門市	台南市歸仁區歸仁大道101號
星巴克	台南高鐵門市	台南市歸仁區歸仁大道100號
星巴克	奇美博物館門市	台南市仁德區文華路二段66號
星巴克	仁德北門市	台南市仁德區中洲村中洲1-16號
星巴克	仁德南門市	台南市仁德區中洲村中洲1-15號
星巴克	路竹門市	高雄市路竹區中山路475號
星巴克	佛陀館門市	高雄市大樹區統嶺路1號
星巴克	岡山門市	高雄市岡山區中山北路110號
星巴克	義大城門市	高雄市大樹區學城路一段12號1樓
星巴克	屏東自由門市	屏東縣屏東市自由路601號
星巴克	屏東門市	屏東縣屏東市中正路72號
星巴克	屏東民生門市	屏東縣屏東市民生路5-5號
星巴克	楠梓門市	高雄市楠梓區楠梓新路225號
星巴克	楠梓藍昌門市	高雄市楠梓區藍昌路480號
星巴克	楠梓德民門市	高雄市楠梓區德民路828號
星巴克	楠梓日月光門市	高雄市楠梓區楠梓加工出口區第二園區研發路66號1F
星巴克	博愛華夏門市	高雄市左營區博愛四路508號
星巴克	仁武仁雄門市	高雄市仁武區仁雄路92號
星巴克	新光左營門市	高雄市左營區高鐵路123號1樓
星巴克	環球左營門市	高雄市左營區站前北路1號2樓
星巴克	左營高鐵門市	高雄市左營區高鐵路105號2F
星巴克	高雄榮總門市	高雄市左營區大中一路386號 (門診大樓1F)
星巴克	天祥門市	高雄市三民區天祥一路118號
星巴克	高雄博愛門市	高雄市左營區博愛三路82號
星巴克	高雄長庚門市	高雄市鳥松區大埤路123號2F (醫學大樓2F)
星巴克	漢神巨蛋門市	高雄市左營區博愛二路777號2樓
星巴克	本館門市	高雄市鳥松區本館路211號
星巴克	裕誠門市	高雄市左營區裕誠路396、396-1
星巴克	明誠門市	高雄市三民區明誠二路72號
星巴克	新大順門市	高雄市三民區民族一路427號1F
星巴克	澄清文衡門市	高雄市三民區文衡路505號
星巴克	明倫門市	高雄市鼓山區明誠三路588號
星巴克	鳳山建國門市	高雄市鳳山區建國路三段360號
星巴克	大順富民門市	高雄市左營區大順一路380號
星巴克	美術館門市	高雄市鼓山區明誠四路118號
星巴克	高雄九如門市	高雄市三民區九如一路562號
星巴克	鳳山光遠門市	高雄市鳳山區光遠路396號
星巴克	十全門市	高雄市三民區十全一路183號
星巴克	潮州門市	屏東縣潮州鎮延平路35號
星巴克	美術願景門市	高雄市鼓山區美術東二路9號
星巴克	中正河北門市	高雄市苓雅區中正一路321號
星巴克	高雄中正門市	高雄市新興區中正二路162號
星巴克	七賢門市	高雄市新興區七賢一路291、293號
星巴克	廣林門市	高雄市苓雅區廣州一街149-1號1樓
星巴克	愛河門市	高雄市前金區河東路356號1樓
星巴克	四維民權門市	高雄市苓雅區四維三路17號
星巴克	中央公園門市	高雄市前金區五福三路31號
星巴克	高雄瑞隆門市	高雄市前鎮區瑞隆路438號
星巴克	漢神本館B1門市	高雄市前金區成功一路266-1號B1F
星巴克	三多門市	高雄市苓雅區三多三路234 236號1樓
星巴克	青年門市	高雄市苓雅區成功一路221號1樓
星巴克	高雄遠百門市	高雄市苓雅區三多四路21號
星巴克	駁二誠品門市	高雄市鹽埕區大勇路3號(C4倉庫)
星巴克	西子灣門市	高雄市鼓山區哨船街14號
星巴克	高雄夢時代門市	高雄市前鎮區中華五路789號1F
星巴克	高雄時代門市	高雄市前鎮區中華五路789號4樓
星巴克	小港宏平門市	高雄市小港區宏平路480號
星巴克	小港國際站門市	高雄市小港區中山四路2號 (一樓入境大廳)
星巴克	屏東東港門市	屏東縣東港鎮光復路一段356號
星巴克	金門金湖門市	金門縣金湖鎮太湖路二段198號
星巴克	金門伯玉門市	金門縣金寧鄉伯玉路2段223號
星巴克	海生館門市	屏東縣車城鄉後灣村後灣路2號
星巴克	恆春門市	屏東縣恆春鎮恒公路952-1號
星巴克	墾丁福華門市	屏東縣恆春鎮墾丁路2號
